<?xml version="1.0" encoding="UTF-8"?>
<recetas xmlns:xsi="http://www.w3.org/2001/XMLSchema-instance"
        xsi:noNamespaceSchemaLocation="recetas.xsd">

    <receta>
        <nombre>Ensalada Mediterránea</nombre>
        <categoria>Entrada</categoria>
        <tiempo>15 min</tiempo>
        <dificultad>Fácil</dificultad>
        <porciones>2 personas</porciones>
        <calorias>150 kcal</calorias>
        <imagen>../img/ensalada-mediterránea.jpg</imagen>
        <descripcion>Una ensalada fresca y colorida con los sabores intensos del Mediterráneo: queso feta cremoso, aceitunas negras, tomates cherry jugosos y un aderezo de aceite de oliva. Perfecta como entrada o comida ligera.</descripcion>
        <nutricion>
            <grasas>12g</grasas>
            <proteina>7g</proteina>
            <carbohidratos>3g</carbohidratos>
        </nutricion>
        <ingredientes>
            <ingrediente>200 g de tomates cherry</ingrediente>
            <ingrediente>150 g de pepino</ingrediente>
            <ingrediente>100 g de queso feta</ingrediente>
            <ingrediente>50 g de aceitunas negras</ingrediente>
            <ingrediente>½ cebolla morada</ingrediente>
            <ingrediente>2 cucharadas de aceite de oliva</ingrediente>
            <ingrediente>1 cucharada de vinagre balsámico</ingrediente>
            <ingrediente>Orégano al gusto</ingrediente>
            <ingrediente>Sal y pimienta negra</ingrediente>
        </ingredientes>
        <pasos>
            <paso>Lava y corta los tomates cherry por la mitad.</paso>
            <paso>Corta el pepino en medias lunas y la cebolla morada en juliana fina.</paso>
            <paso>Desmorona el queso feta en trozos medianos con las manos.</paso>
            <paso>En un bowl grande, combina los tomates, pepino y cebolla.</paso>
            <paso>Agrega las aceitunas y el queso feta por encima.</paso>
            <paso>Mezcla el aceite de oliva, vinagre balsámico, orégano, sal y pimienta para el aderezo.</paso>
            <paso>Vierte el aderezo sobre la ensalada y mezcla con suavidad.</paso>
            <paso>Deja reposar 5 minutos antes de servir para que se integren los sabores.</paso>
        </pasos>
        <consejo>Usa siempre ingredientes frescos y de temporada. Puedes agregar aguacate en cubos o nueces tostadas para más textura. Si quieres una versión más ligera, reduce el queso feta a 60 g. El aderezo de limón también funciona muy bien en lugar del balsámico.</consejo>
        <slug>ensalada-mediterranea</slug>
    </receta>

    <receta>
        <nombre>Pasta a la Carbonara</nombre>
        <categoria>Plato Fuerte</categoria>
        <tiempo>40 min</tiempo>
        <dificultad>Fácil</dificultad>
        <porciones>6 personas</porciones>
        <calorias>620 kcal</calorias>
        <imagen>../img/pasta-a-la-carbonara.jpg</imagen>
        <descripcion>La auténtica carbonara romana: spaghetti al dente bañados en una salsa cremosa de yemas, queso parmesano y guanciale crujiente. Sin crema, sin atajos — pura técnica italiana que enamora a cada bocado.</descripcion>
        <nutricion>
            <grasas>24g</grasas>
            <proteina>24g</proteina>
            <carbohidratos>54g</carbohidratos>
        </nutricion>
        <ingredientes>
            <ingrediente>500 g de pasta (spaghetti o rigatoni)</ingrediente>
            <ingrediente>200 g de guanciale (o panceta)</ingrediente>
            <ingrediente>5 yemas de huevo</ingrediente>
            <ingrediente>1 huevo entero</ingrediente>
            <ingrediente>100 g de queso parmesano rallado</ingrediente>
            <ingrediente>Pimienta negra recién molida al gusto</ingrediente>
            <ingrediente>Sal (solo para el agua de cocción)</ingrediente>
        </ingredientes>
        <pasos>
            <paso>Cuece la pasta al dente en agua generosamente salada. Reserva 1 taza del agua de cocción antes de escurrir.</paso>
            <paso>En una sartén sin aceite, fríe el guanciale cortado en tiras hasta que esté dorado y crujiente. Apaga el fuego y reserva.</paso>
            <paso>Bate las yemas con el huevo entero, el queso parmesano rallado y abundante pimienta negra recién molida.</paso>
            <paso>Escurre la pasta y agrégala directamente a la sartén con el guanciale (sin fuego).</paso>
            <paso>Vierte la mezcla de huevo y queso sobre la pasta, revolviendo rápido. Agrega cucharadas del agua de cocción para lograr una textura cremosa y sedosa.</paso>
            <paso>Sirve de inmediato con más queso y pimienta por encima.</paso>
        </pasos>
        <consejo>Nunca uses crema: la textura cremosa se logra únicamente con las yemas, el queso y el agua de cocción con almidón. El truco clave es mezclar fuera del fuego para que el huevo no se cuaje. Si no consigues guanciale, la panceta ahumada es la mejor alternativa.</consejo>
        <slug>pasta-carbonara</slug>
    </receta>

    <receta>
        <nombre>Tiramisu</nombre>
        <categoria>Postre</categoria>
        <tiempo>25 min</tiempo>
        <dificultad>Fácil</dificultad>
        <porciones>6 personas</porciones>
        <calorias>420 kcal</calorias>
        <imagen>../img/tiramisu.jpg</imagen>
        <descripcion>El clásico postre italiano con capas de soletas empapadas en café espresso y una crema suave de mascarpone. Elegante, sin horno y con ese equilibrio perfecto entre lo dulce y lo amargo.</descripcion>
        <nutricion>
            <grasas>28g</grasas>
            <proteina>6g</proteina>
            <carbohidratos>35g</carbohidratos>
        </nutricion>
        <ingredientes>
            <ingrediente>2 paquete de soletas o bizcotelas (Ladyfingers)</ingrediente>
            <ingrediente>500 g de queso mascarpone o queso crema</ingrediente>
            <ingrediente>400 ml de crema para batir</ingrediente>
            <ingrediente>8 a 9 cucharadas de azúcar</ingrediente>
            <ingrediente>2 taza de café espresso frío</ingrediente>
            <ingrediente>Cacao en polvo sin azúcar para espolvorear</ingrediente>
        </ingredientes>
        <pasos>
            <paso>Bate el queso mascarpone con la crema para batir y el azúcar hasta obtener una mezcla suave y firme.</paso>
            <paso>Prepara el café espresso y déjalo enfriar completamente.</paso>
            <paso>Sumerge brevemente cada soleta en el café frío (solo 1 segundo por cada lado para que no se deshagan).</paso>
            <paso>En un molde rectangular, forma la primera capa de soletas empapadas en café.</paso>
            <paso>Extiende una capa generosa de la crema de mascarpone sobre las soletas.</paso>
            <paso>Repite el proceso con otra capa de soletas y termina cubriendo con crema.</paso>
            <paso>Espolvorea generosamente con cacao en polvo y refrigera mínimo 2 a 3 horas antes de servir.</paso>
        </pasos>
        <consejo>El secreto está en no remojar demasiado las soletas: un segundo de cada lado es suficiente. Si las dejas más tiempo se deshacen y arruinan la textura. Para mejores resultados, refrigera el tiramisu de 6 a 8 horas, o incluso de un día para otro: los sabores se integran mucho mejor.</consejo>
        <slug>tiramisu</slug>
    </receta>

    <receta>
        <nombre>Ramen</nombre>
        <categoria>Entrada</categoria>
        <tiempo>1 h 15 min</tiempo>
        <dificultad>Intermedio</dificultad>
        <porciones>6 personas</porciones>
        <calorias>480 kcal</calorias>
        <imagen>../img/ramen.jpg</imagen>
        <descripcion>Sopa tradicional japonesa con caldo profundo y aromático, fideos elásticos, proteínas variadas y verduras frescas. Un tazón reconfortante con capas de sabor que se construyen con paciencia y buenos ingredientes.</descripcion>
        <nutricion>
            <grasas>15g</grasas>
            <proteina>38g</proteina>
            <carbohidratos>46g</carbohidratos>
        </nutricion>
        <ingredientes>
            <ingrediente>2 litros de agua o caldo de res</ingrediente>
            <ingrediente>2 cucharadas de aceite de ajonjolí (sésamo)</ingrediente>
            <ingrediente>1 cucharada de jengibre fresco picado</ingrediente>
            <ingrediente>3 dientes de ajo machacados</ingrediente>
            <ingrediente>1 cebolla blanca en cuartos</ingrediente>
            <ingrediente>2 cucharadas de salsa de soya baja en sodio</ingrediente>
            <ingrediente>1 cucharada de miso (opcional)</ingrediente>
            <ingrediente>1 cubo de consomé de res o pollo</ingrediente>
            <ingrediente>2 cucharadas de vinagre de arroz o manzana</ingrediente>
            <ingrediente>500 g de pechuga de pollo en tiras</ingrediente>
            <ingrediente>200 g de carne de res (falda o lomo)</ingrediente>
            <ingrediente>6 huevos</ingrediente>
            <ingrediente>200 g de tofu firme en cubos (opcional)</ingrediente>
            <ingrediente>500 g de fideos ramen integrales o normales</ingrediente>
            <ingrediente>1 zanahoria grande en tiras</ingrediente>
            <ingrediente>1 taza de espinaca o acelga</ingrediente>
            <ingrediente>1 taza de brotes de soya</ingrediente>
            <ingrediente>1 puerro o cebollín en rodajas finas</ingrediente>
            <ingrediente>1 taza de champiñones (shiitake o blancos)</ingrediente>
            <ingrediente>Algas nori en tiras (opcional)</ingrediente>
        </ingredientes>
        <pasos>
            <paso>Calienta el aceite de ajonjolí en una olla grande a fuego medio. Sofríe el ajo y el jengibre por 2 minutos hasta que aromen.</paso>
            <paso>Agrega la cebolla en cuartos y deja dorar ligeramente por 3 minutos más.</paso>
            <paso>Vierte el agua o caldo, la salsa de soya, el miso y el consomé. Lleva a ebullición y luego baja el fuego. Cocina a fuego bajo por 30 minutos.</paso>
            <paso>Mientras tanto, cuece los huevos en agua hirviendo por 7 minutos para obtener una yema semilíquida. Enfría en agua con hielo, pela y reserva.</paso>